{
  "protocolVersion": "1.0",
  "taskId": "task_facts_001",
  "attemptId": "attempt_facts_001",
  "projectId": "project_tju_demo",
  "taskType": "generate",
  "stage": "facts",
  "userIntent": "从两份公司资料中提取企业事实与证据，保留冲突与缺失。",
  "baseVersions": [],
  "inputRefs": [
    {
      "refType": "document",
      "refId": "doc_profile",
      "versionId": "docv_profile_1",
      "contentHash": "sha256:75ff3b1e1d5d9ed1f677d98db1f9e6a9763875c8e0d315ba9bd7e12c2e1f8daa"
    },
    {
      "refType": "document",
      "refId": "doc_update",
      "versionId": "docv_update_1",
      "contentHash": "sha256:161617336d51108b4a3f999eb1474a16327cd1de735d0afe6608a0f775ad2e95"
    }
  ],
  "constraints": {
    "preserveFacts": true,
    "forbiddenNewFacts": true,
    "brand": "tju-mas",
    "notes": "合成夹具，用于协议校验测试。"
  },
  "executionPolicyRef": "policy_facts_v1",
  "createdAt": "2025-01-10T08:00:00Z"
}
